{
  "$schema": "https://json-schema.org/draft/2020-12/schema",
  "$id": "https://f150-garage-assistant.local/schema/maintenance_item.schema.json",
  "title": "Maintenance Item",
  "type": "object",
  "required": [
    "id",
    "schemaVersion",
    "entityType",
    "knowledgeScope",
    "name",
    "description"
  ],
  "properties": {
    "id": {
      "type": "string",
      "pattern": "^[a-z0-9][a-z0-9._-]*$"
    },
    "schemaVersion": {
      "type": "integer",
      "minimum": 1
    },
    "entityType": {
      "const": "maintenance_item"
    },
    "knowledgeScope": {
      "enum": [
        "generic",
        "vehicle_specific",
        "configuration_specific"
      ]
    },
    "status": {
      "enum": [
        "draft",
        "verified",
        "deprecated"
      ]
    },
    "createdAt": {
      "type": [
        "string",
        "null"
      ],
      "format": "date-time"
    },
    "updatedAt": {
      "type": [
        "string",
        "null"
      ],
      "format": "date-time"
    },
    "name": {
      "type": "string"
    },
    "description": {
      "type": "string"
    },
    "systemId": {
      "type": [
        "string",
        "null"
      ]
    },
    "applicability": {
      "type": "object",
      "properties": {
        "vehicleIds": {
          "type": "array",
          "items": {
            "type": "string"
          },
          "uniqueItems": true
        },
        "configurationIds": {
          "type": "array",
          "items": {
            "type": "string"
          },
          "uniqueItems": true
        },
        "conditions": {
          "type": "array",
          "items": {
            "type": "object"
          }
        },
        "exclusions": {
          "type": "array",
          "items": {
            "type": "object"
          }
        }
      },
      "additionalProperties": false
    },
    "interval": {
      "type": [
        "object",
        "null"
      ]
    },
    "procedureIds": {
      "type": "array",
      "items": {
        "type": "string"
      },
      "uniqueItems": true
    },
    "referenceIds": {
      "type": "array",
      "items": {
        "type": "string"
      },
      "uniqueItems": true
    }
  },
  "additionalProperties": false
}
